{"schemaVersion":"cli-json.v1","command":"resolve","status":"resolved","confirmation":"strong_reference","work":{"title":"Cien años de soledad","authors":["Gabriel García Márquez"],"firstPublicationYear":1967,"contentLanguages":["es"],"references":[{"namespace":"openlibrary:work","value":"OL274505W"},{"namespace":"wikidata:item","value":"Q178869"}]},"warnings":[]}
