{"schemaVersion":"cli-json.v1","command":"titles","status":"found","work":{"title":"Cien años de soledad","authors":["Gabriel García Márquez"],"firstPublicationYear":1967,"contentLanguages":["es"],"references":[{"namespace":"openlibrary:work","value":"OL274505W"},{"namespace":"wikidata:item","value":"Q178869"}]},"targetLanguages":["es","zh"],"groups":[{"language":"es","title":"Cien años de soledad","subtitle":null,"level":"verified","recommended":true,"satisfiesRequest":true,"originalTitle":true,"attestations":[{"source":"openlibrary","role":"edition_title","text":"Cien años de soledad","subtitle":null,"language":"es","sourceRecordUrl":"https://openlibrary.org/books/OL274507M.json","references":[{"namespace":"openlibrary:edition","value":"OL274507M"}],"stale":false,"fetchedAt":"2026-09-05T12:34:56.789Z"},{"source":"openlibrary","role":"work_original_title","text":"Cien años de soledad","subtitle":null,"language":"es","sourceRecordUrl":"https://openlibrary.org/works/OL274505W.json","references":[{"namespace":"openlibrary:work","value":"OL274505W"}],"stale":false,"fetchedAt":"2026-09-05T12:34:56.789Z"},{"source":"wikidata","role":"work_original_title","text":"Cien años de soledad","subtitle":null,"language":"es","sourceRecordUrl":"https://www.wikidata.org/wiki/Special:EntityData/Q178869.json","references":[{"namespace":"wikidata:item","value":"Q178869"}],"statementId":"Q178869-1","rank":"normal","stale":false,"fetchedAt":"2026-09-05T12:34:56.789Z"}]},{"language":"zh","title":"Bai nian gu du","subtitle":null,"level":"verified","recommended":true,"satisfiesRequest":true,"originalTitle":false,"attestations":[{"source":"openlibrary","role":"edition_title","text":"Bai nian gu du","subtitle":null,"language":"zh","sourceRecordUrl":"https://openlibrary.org/books/OL59138652M.json","references":[{"namespace":"openlibrary:edition","value":"OL59138652M"}],"stale":false,"fetchedAt":"2026-09-05T12:34:56.789Z"}]},{"language":"zh","title":"百年孤独","subtitle":null,"level":"probable","recommended":false,"satisfiesRequest":true,"originalTitle":false,"attestations":[{"source":"openlibrary","role":"edition_title","text":"百年孤独","subtitle":null,"language":"zh","sourceRecordUrl":"https://openlibrary.org/books/OL43416865M.json","references":[{"namespace":"openlibrary:edition","value":"OL43416865M"}],"stale":false,"fetchedAt":"2026-09-05T12:34:56.789Z"}]}],"warnings":[{"source":"openlibrary","code":"detached_work","references":[{"namespace":"openlibrary:edition","value":"OL43416865M"}],"details":{"otherWork":"openlibrary:work:OL43416865W"}}]}
