{"schemaVersion":"cli-json.v1","command":"search","status":"found","candidates":[{"title":"Cien años de soledad","alternativeTitles":["百年孤独"],"authors":["Gabriel García Márquez"],"publicationYear":1967,"contentLanguages":["es"],"references":[{"namespace":"openlibrary:work","value":"OL274505W"},{"namespace":"wikidata:item","value":"Q178869"}]}],"warnings":[]}
